{
  "version": "2.3-MVP",
  "constants": {
    "financial": {
      "startingCash": 5000.0,
      "annualSavings": 50000.0,
      "amortizationYears": 30
    },
    "operations": {
      "adrBaseline2BR": 350.0,
      "occupancyBaseline": 0.65,
      "mgmtPct": 0.20,
      "capexPct": 0.05,
      "hoaAnnual": 10200.0,
      "hoaInflationRate": 0.03,
      "insuranceRate": 0.008,
      "propertyTaxRate": 0.009
    },
    "acquisition": {
      "downPaymentFirst": 0.20,
      "downPaymentSubsequent": 0.25,
      "closingCostPct": 0.03,
      "targetYieldUnlevered": 0.085
    },
    "debt": {
      "mortgageRate": 0.0685
    },
    "reserves": {
      "capexMonthsTarget": 6
    }
  },
  "calendar": {
    "monthlyDays": [31, 28, 31, 30, 31, 30, 31, 31, 30, 31, 30, 31]
  },
  "policies": {
    "purchase": { "allowFeederForClosing": true },
    "prepay":   { "tieBreak": "lowestLTV_thenLargestBalance" },
    "freeze":   { "margin": 0.0, "exitConsecutiveMonths": 1 },
    "portfolio":{ "maxUnits": 7 },
    "debt":     { "dayCount": "ACT/365" }
  },
  "startingBalances": {
    "HY_Unrestricted": 0.0,
    "HY_RainyReserve": 0.0,
    "HY_CapexReserve": 0.0
  },
  "banking": {
    "rainyCoverageMonths": 6
  },
  "savings": {
    "annualYield": 0.04,
    "prepayPct": 1.0
  },
  "lending": {
    "advanceRate": 0.75,
    "targetLTV": 0.75,
    "cashoutCostPct": 0.03,
    "seasoningMonths": 6
  },
  "portfolio": {
    "maxLoans": 7
  },
  "market": {
    "annualAppreciation": 0.03
  }
}
